Author,Title,Class Number,Class Name,Quarter,Year,Descriptors,Location,"Bee, James William",A preliminary report of the ecology of False Bay,Zoology 533,Advanced Invertebrate Zoology,Summer,1949,Macoma; Transennella tantilla; Rochefortia tumida,"False Bay, San Juan Island","Comita, Gabriel W.",Copepod commensals of pelecypods,Zoology 533,Advanced Invertebrate Zoology,Summer,1949,Paranthessius; Schizothaerus; Herrmannella finmarchica,,"Comita, Gabriel W.",A list of the common molluscs collected during the Summer session of 1949,Zoology 533,Advanced Invertebrate Zoology,Summer,1949,,,"Dunn, Margaret E.",Parasitic Cirripedia and Isopoda infesting shrimp collected in the vicinity of San Juan Island,Zoology 225,Advanced Invertebrate Zoology,Summer,1949,Mycetomorpha; Sylon; Spirontocaris moseri,San Juan Island,"Oldenborg, Elizabeth A",Some errant polychaetes of Friday Harbor area,Zoology 225,Advanced Invertebrate Zoology,Summer,1949,,Friday Harbor,"Oldenborg, Elizabeth",Studies in regeneration in polychaete worms,Zoology 225,Advanced Invertebrate Zoology,Summer,1949,"Eudistylia polymorpha; Serpula vermicularis",,"Annan, Murvel E.",A study of the fauna of Jones' Beach,Zoology 533,Advanced Invertebrate Zoology,Summer,1950,Macoma; Protothaca staminea,"Jones' Beach, San Juan Island","Arny, Samuel A.","Some notes on the movements of two species of littorine snails, Littorina sitchana and Littorina scutulata",Zoology 533,Advanced Invertebrate Zoology,Summer,1950,"Littorina sitkana; Littorina scutulata",,"Barkas, Earl H.",Intertidal pelecypods of Argyle Lagoon and adjacent beaches,Zoology 533,Advanced Invertebrate Zoology,Summer,1950,Upogebia; Bankia; Rochefortia,"Argyle Lagoon, San Juan Island","Bell, G. Mary",Some Phoronida of Puget Sound,Zoology 533,Advanced Invertebrate Zoology,Summer,1950,"Phoronis; Phoronopsis",Puget Sound,"Hickok, John F.",A study of the commensal relationship of the polychaete Halosydna brevisetosa Kinberg and its host Amphitrite robusta Johnson,Zoology 233,Advanced Invertebrate Zoology,Summer,1950,Halosydna brevisetosa; Amphitrite robusta; Eupolymnia,,"Knight, Patricia F.",Characteristics for the separation of the species in the genus Strongylocentrotus Brandt,Zoology 533,Advanced Invertebrate Zoology,Summer,1950,Strongylocentrotus droebachiensis; Strongylocentrotus purpuratus; Strongylocentrotus franciscanus,,"Krogstad, Blanchard",A collection of the amphipods of the San Juan Islands and vicinity with records of their occurrence and color in nature,Zoology 533,Advanced Invertebrate Zoology,Summer,1950,Melita dentata; Paragrubia uncinata; Parallorchestes,San Juan Islands,"MacPhee, Chris",Holothurians of the genus Cucumaria collected in the San Juan Islands in the Summer of 1950,Zoology 533,Advanced Invertebrate Zoology,Summer,1950,Cucumaria populifera; Cucumaria miniata; Cucumaria,San Juan Islands,"Plumb, Marjorie","Some identification and life history studies of Aglaja, a tectibranch of San Juan Island, Washington",Zoology 233,Advanced Invertebrate Zoology,Summer,1950,Aglaja; Philine; Aglaja diomedea,San Juan Island,"Tiner, Jack D.",Observations on the marine free-living nematodes of the San Juan Islands,Zoology 233,Advanced Invertebrate Zoology,Summer,1950,,San Juan Islands,"Wellings, S.R.","Observations on the vertical distribution and constancy of position of four species of Acmaea at Friday Harbor, Washington",Zoology 233,Advanced Invertebrate Zoology,Summer,1950,Acmaea,Brown Island; Friday Harbor,"Bowes, Pat",A brief survey of the commensals and parasites of the collenterata,Zoology 533,Advanced Invertebrate Zoology,Summer,1951,Hydrozoa; Scyphozoa; Anthozoa,,"Clark, David T.",Some larval trematodes from the vicinity of Friday Harbor,Zoology 533,Advanced Invertebrate Zoology,Summer,1951,Cytopherous cercaria; Thais emarginata; Thais lamellosa,Friday Harbor,"Finucane, John H.",Observations on Schizothaerus nuttallii nuttallii (Conrad) and Schizothaerus nuttallii capax (Gould),Zoology 533,Advanced Invertebrate Zoology,Summer,1951,"Schizothaerus nuttallii nuttallii; Schizothaerus nuttallii capax; Lumbrineris brevicirra",,"Hand, C.",Comments on report of D.A. James on Sea Anemones of San Juan Islands,Zoology 533,Advanced Invertebrate Zoology,Summer,1951,,San Juan Islands,"Judson, Charles L.",A guide to the genus Cucumaria of Friday Harbor and adjacent areas,Zoology 533,Advanced Invertebrate Zoology,Summer,1951,Cucumaria; Holothurian,Friday Harbor,"Karlstrom, Ernest L.",Intraspecific variation in Dendraster excentricus Eschcholtz from two localities in the San Juan Islands,Zoology 533,Advanced Invertebrate Zoology,Summer,1951,Dendraster excentricus,"False Bay, San Juan Island; Crescent Beach, Orcas Island","Norton, John R.",A taxonomic study of the family Calyptraeidae of the waters of the San Juan archipelago and vicinity,Zoology 533,Advanced Invertebrate Zoology,Summer,1951,"Calyptraeidae",San Juan Islands,"Schoenig, Enrique H.",A study of the influence of ecological factors upon the form and density of the shells of three species of Acmaea,Zoology 533,Advanced Invertebrate Zoology,Summer,1951,Acmaea persona; Acmaea pelta; Acmaea scutum,,"Snyder, Richard C","A preliminary key to the Tunicates of the Friday Harbor, Washington, region",Zoology 533,Advanced Invertebrate Zoology,Summer,1951,,Friday Harbor,"Webb, Olin L","A contribution to the natural history of the beach hopper, Orchestia triskiana Stimpson",Zoology 533,Advanced Invertebrate Zoology,Summer,1951,"Orchestia traskiana",,"Eschenberg, K.",On the symbiotic relationships of holothurians of the Friday Harbor region,Zoology 533,Advanced Invertebrate Zoology,Summer,1952,Cucumaria; Stichopus californicus; Leptosynapta,Friday Harbor,"Foreman, Margaret H.",An experimental study of evisceration in holothurians,Zoology 533,Advanced Invertebrate Zoology,Summer,1952,,,"Goodman, Donald Charles",An ecological variation in the number of interambulacral plates in Strongylocentrotus droebachiensis (O. Fr. Muller),Zoology 533,Advanced Invertebrate Zoology,Summer,1952,Strongylocentrotus droebachiensis; Strongylocentrotus; Temnopleurus,,"Lauff, G.H.","A faunal study of wharf pilings on San Juan Island, Washington",Zoology 533,Advanced Invertebrate Zoology,Summer,1952,,"San Juan Island","Yowell, H.",A study of barnacle distribution,Zoology 533,Advanced Invertebrate Zoology,Summer,1952,Balanus glandula; Balanus cariosus,"Turn Point, San Juan Island","Anderson, G.C.",A study of some ecological factors in tide pools,Zoology 533,Advanced Invertebrate Zoology,Summer,1953,,"Mar Vista, San Juan Island","Anderson, Sydney","Some observations of the numbers and distribution of common intertidal animals at Friday Harbor, Washington",Zoology 533,Advanced Invertebrate Zoology,Summer,1953,Balanus; Littorina; Acmaea,Friday Harbor,"Boddy, Dennis W.","The Gammaridea (Amphipoda) of the San Juan Islands: a preliminary study of their taxonomy, distribution, and habitats",Zoology 533,Advanced Invertebrate Zoology,Summer,1953,,San Juan Islands,"Engstrom, Verna Louise",The vertical distribution of several common intertidal invertebrates on a rocky shore,Zoology 533,Advanced Invertebrate Zoology,Summer,1953,Acmaea; Littorina scutulata,Brown Island,"Garoian, George S.","The burrows and burrowing of Upogebia pugettensis, Thelepus crispus, Eupolymnia heterobranchia, and Nereis virens",Zoology 533,Advanced Invertebrate Zoology,Summer,1953,Upogebia pugettensis; Thelepus crispus; Eupolymnia heterobranchia; Nereis virens,,"Heck, Oscar B.",A study of the zonation of some animals on an exposed rocky point,Zoology 533,Advanced Invertebrate Zoology,Summer,1953,,,"Orihel, Thomas Charles",A key to the nudibranchiate mollusca of the San Juan Island area including descriptive notes,Zoology 533,Advanced Invertebrate Zoology,Summer,1953,,San Juan Islands,"Russell, Robert J.",Notes on the ecological distribution and commensals of hermit crabs in the San Juan Islands,Zoology 533,Advanced Invertebrate Zoology,Summer,1953,,San Juan Islands,"Stains, Howard J.",The marking of sea urchins of the genus Strongylocentrotus in a study of their movement,Zoology 533,Advanced Invertebrate Zoology,Summer,1953,"Strongylocentrotus droebachiensis; Strongylocentrotus purpuratus",,"Tucker, Marie",A study of the terebellid polychaetes of the Friday Harbor region,Zoology 533,Advanced Invertebrate Zoology,Summer,1953,,Friday Harbor,"Vincent, Brother I.",A study of the home range of Thais lamellosa,Zoology 533,Advanced Invertebrate Zoology,Summer,1953,"Thais lamellosa",,"Black, Robert E.L.","The anatomy of a parasitic gastropod in the holothurian, Parastichopus californicus",Zoology 533,Advanced Invertebrate Zoology,Summer,1954,"Entoconcha mirabilis; Parastichopus californicus",,"Bowman, Douglas",Notes on the anatomy of Cryptochiton stellari middendorf,Zoology 533,Advanced Invertebrate Zoology,Summer,1954,"Cryptochiton stellari",,"Bumgardner, Jess",A study of total salinity effects on gill cilia of Mytilus edulis and Mytilus californianus,Zoology 533,Advanced Invertebrate Zoology,Summer,1954,"Mytilus edulis; Mytilus californianus",,"Clogston, Fred L.",Preliminary survey of the fauna living directly upon Zostera marina (Linne) in the San Juan Island-Puget Sound Region; with notes on seasonal variations,Zoology 533,Advanced Invertebrate Zoology,Summer,1954,Zostera marina,"Brown Island; False Bay, San Juan Island; Argyle Lagoon, San Juan Island","Dodge, Eleanor",A study of the interrelationships between pecten and associated sponges in the Puget Sound area,Zoology 533,Advanced Invertebrate Zoology,Summer,1954,Pecten; Myxilla parasitica; Mycale adhaerens,Puget Sound,"Dudley, Patricia L.",A brief taxonomic survey of the shrimp of the family Hippolytidae from the waters of the San Juan archipelago with a key to the Hippolytidae of Washington,Zoology 533,Advanced Invertebrate Zoology,Summer,1954,Spirontocaris; Hippolytidae; Cragonidae,San Juan Islands,"Gonor, Jefferson J.",Observations on the embryology of Phylliaplysia taylori Dall,Zoology 533,Advanced Invertebrate Zoology,Summer,1954,"Phyllaplysia taylori",,"Kaplan, Eugene H.",Some factors concerned with the resistance to tidal currents and crowding as shown by certain tide pool organisms,Zoology 533,Advanced Invertebrate Zoology,Summer,1954,,,"Malcolm, David R.",Resistance to desiccation and submergence as correlated to the zonal distribution of three species of intertidal snails,Zoology 533,Advanced Invertebrate Zoology,Summer,1954,Littorina scutulata; Littorina sitkana; Thais lamellosa,,"Nydegger, LeRoy B.",Observations on the behavior of Schizobranchia insignis Bush,Zoology 533,Advanced Invertebrate Zoology,Summer,1954,Schizobranchia insignis; Sabella pavonina; Pseudopotamilla occelata; Potamilla occelata,,"Osborn, Howard H.",A revision of the taxonomic key of the medusae found in the San Juan waters,Zoology 533,Advanced Invertebrate Zoology,Summer,1954,Leuckartiara,San Juan Islands,"Pangburn, Joan",A study of the radula of chitons in the species Tonicella lineata Wood,Zoology 533,Advanced Invertebrate Zoology,Summer,1954,,,"Cloney, Richard A.",Notes on the bottom fauna of a portion of East Sound,Zoology 533,Advanced Invertebrate Zoology,Summer,1955,,"East Sound, Orcas Island; Twin Rocks","Gillespie, Walter L.","A comparison of tide pools on limestone and ""igneous"" rock",Zoology 533,Advanced Invertebrate Zoology,Summer,1955,,,"Heinsohn, George E.",A comparative study of some tide pools at Kanaka Point,Zoology 533,Advanced Invertebrate Zoology,Summer,1955,,Kanaka Point,"Throckmorton, Lynn H.",A comparison of the fauna found and its distribution on two beaches in the region of False Bay,Zoology 533,Advanced Invertebrate Zoology,Summer,1955,,"False Bay, San Juan Island","West, George C.","Comparison of the fauna and flora on limestone and ""igneous"" rock",Zoology 533,Advanced Invertebrate Zoology,Summer,1955,,,"Chammek, Ard",Eel grass (Zostera) and the organisms associated with it at Argyle Lagoon,Zoology 533,Advanced Invertebrate Zoology,Summer,1955,Zostera,"Argyle Lagoon, San Juan Island","Pilon, Lorraine M.",Nudibranchs of the San Juan Islands,Zoology 533,Advanced Invertebrate Zoology,Summer,1956,,San Juan Islands,"Schinske, Robert",The fauna and ecology of Argyle Creek,Zoology 533,Advanced Invertebrate Zoology,Summer,1956,,"Argyle Creek, San Juan Island","Ching, Hilda Lei","A preliminary report on larval trematode studies at Friday Harbor, Washington",Zoology 533,Advanced Invertebrate Zoology,Summer,1957,"Cystophorous cercariae",Friday Harbor,"George, Carl J., Jr.",A survey of animal forms occuring on a transect running north-west from the northwest corner of Brown Island,Zoology 533,Advanced Invertebrate Zoology,Summer,1957,,Brown Island,"Jones, Laurence G.",A study of the chitons of San Juan Island and vicinity,Zoology 533,Advanced Invertebrate Zoology,Summer,1957,,San Juan Island,"Karl, John E., Jr.",A student report of the Amphipoda of the San Juan Islands,Zoology 533,Advanced Invertebrate Zoology,Summer,1957,"Gammaridea",San Juan Islands,"Marsh, Michael",A key to the nudibranchiate gastropods of the San Juan Islands,Zoology 533,Advanced Invertebrate Zoology,Summer,1957,,San Juan Islands,"Roberts, Larry S.",Determination of acetyl choline type compounds in nerves of various invertebrates,Zoology 533,Advanced Invertebrate Zoology,Summer,1957,"Protothaca staminea",,"Willing, E.S., Jr.","A special marine environment created by Argyle Lagoon, San Juan Island",Zoology 533,Advanced Invertebrate Zoology,Summer,1957,,"Argyle Lagoon, San Juan Island","Higgins, Robert P.",A preliminary study of the kinorhynchs of the San Juan archipelago,Zoology 533,Advanced Invertebrate Zoology,Summer,1958,"Cyclorhagous kinorhynchs; Homalorhagous kinorhynchs",San Juan Islands,"Higgins, Robert P.",Three new homalorhage kinorhynchs from the San Jusan Archipelage. Washington,Zoology 533,Advanced Invertebrate Zoology,Summer,1958,Pycnophyes sanjuanensis; Trachydemus ilvocryptus; Trachydemus cataphractus,San Juan Islands,"Ingels, Nancy",A preliminary study of the behavior of Clinocardium nuttallii in the presence of asteroids,Zoology 533,Advanced Invertebrate Zoology,Summer,1958,Clinocardium nuttallii; Pisaster ochraceus; Cardium californiense,,"Paris, O.H., Jr.",Predation in Balanus-Mytilus communities,Zoology 533,Advanced Invertebrate Zoology,Summer,1958,Thais canaliculata; Mytilus edulis; Balanus,,"Stanley, Hugh P.",Problems of larval settlement at Friday Harbor,Zoology 533,Advanced Invertebrate Zoology,Summer,1958,,Friday Harbor,"Tikasingh, Elisha",Parasitic gastropods of Puget Sound,Zoology 533,Advanced Invertebrate Zoology,Summer,1958,Parastichopus californicus; Cucumaria; Eupentacta,Puget Sound,"Ward, Jack A.",A further investigation on the swimming reaction of Stomphia coccinea,Zoology 533,Advanced Invertebrate Zoology,Summer,1958,Dermasterias imbricata; Crossaster papposus; Hippasteria spinosa,,"Willis, Edwin","A study of sand-dwelling polychaetes in False Bay, Washington",Zoology 533,Advanced Invertebrate Zoology,Summer,1958,Rhynchospio arenincola; Polydora; Notomastus tenuis,"False Bay, San Juan Island","Berger, Jacques","A preliminary survey of the ciliated protozoa entocommensal in the Echinoidea of San Juan County, Washington.",Zoology 533,Advanced Invertebrate Zoology,Summer,1959,"Strongylocentrotus; Dendraster excentricus",San Juan Islands,"Boss, Kenneth Jay",Preliminary keys to the genera and species of pelecypoda of the San Juan area,Zoology 533,Advanced Invertebrate Zoology,Summer,1959,Pelecypod,"San Juan Islands","Chia, Fu-shiang",Regeneration in Leptasterias hexactis,Zoology 533,Advanced Invertebrate Zoology,Summer,1959,Leptasterias hexactis; Leptasterias aequalis; Leptasterias alaskensis,,"Margolin, Abe S.",The Diodora-starfish response,Zoology 533,Advanced Invertebrate Zoology,Summer,1959,Diodora,,"Ramseyer, Linda Marcus",Rheotactic behavior in Ophiopholis aculeata under conflict conditions,Zoology 533,Advanced Invertebrate Zoology,Summer,1959,"Ophiopholis aculeata",,"Salli, Arne J.",Observations on the behavior of hermit crabs,Zoology 533,Advanced Invertebrate Zoology,Summer,1959,Thais lamellosa; Pagurus granosimanus; Balanus cariosus,,"Stewart, Glenn R.",Osmoregulation in the sphaeromid isopods from brackish water at False Bay,Zoology 533,Advanced invertebrate zoology,Summer,1959,Sphaeroma oregonensis; Gnorimosphaeroma,"False Bay, San Juan Island","Twarog, Betty M.",Responses of Pecten hindsii and Pecten hericius to asteroids and certain other stimuli,Zoology 533,Advanced invertebrate zoology,Summer,1959,Strongylocentrotus echinoides; Pecten hindsii; Pecten hericius,,"Urban, Emil K.",Remarks on the vertical intertidal distribution of Littorina in the San Juan archipelago,Zoology 533,Advanced invertebrate zoology,Summer,1959,"Littorina",San Juan Islands,"Weatherly, Norman F.",Rhizocephalan parasites of hermit crabs from the San Juan Island area,Zoology 533,Advanced invertebrate zoology,Summer,1959,Peltogaster; Peltogastrella; Thompsonia,San Juan Islands,"Davis, P.W. Jr.",Some geographical and taxonomic aspects of the host-parasite relationships of the bopyrids and rhizocephalans of the San Juan Island area,Zoology 533,Advanced Invertebrate Zoology,Summer,1960,"Anomura",San Juan Island,"Gardella, C.M.",Caprellidae of the San Juan area,Zoology 533,Advanced Invertebrate Zoology,Summer,1960,"Caprellidae",,"Hermans, Colin O.",A preliminary study of the use of Thorson bottles as a technique for obtaining young polychaetes,Zoology 533,Advanced Invertebrate Zoology,Summer,1960,,,"Goshusp Anklesavia, John",Check list of polychaetes from the Friday Harbor region and a key to the night light polychaetes at the laboratory pier,Zoology 533,Advanced Invertebrate Zoology,Summer,1960,,Friday Harbor,"Johnson, Ned K.","The species problem in the prosobranch genus Lacuna in the Friday Harbor region, Washington",Zoology 533,Advanced Invertebrate Zoology,Summer,1960,"Lacuna",Friday Harbor,"Long, John A.",Some observations on the growth of Terebratalia transversa (Soweby) 1846,Zoology 533,Advanced Invertebrate Zoology,Summer,1960,Terebratalia transversa,,"McCorkle, David V.","Key to the species of Pagurus of the San Juan Island waters (revision of Stevens, 1925)",Zoology 533,Advanced Invertebrate Zoology,Summer,1960,"Pagurus",San Juan Island,"McCorkle, David V.","The distribution and a study of some factors responsible for such distribution of three species of intertidal hermit crabs at San Juan Island, Washington",Zoology 533,Advanced Invertebrate Zoology,Summer,1960,Pagurus hirsutiusculus; Pagurus granosimanus; Pagurus beringanus,San Juan Island,"MacIntyre, Rose",Preliminary report on the cnidom of anemones of the San Juan region,Zoology 533,Advanced Invertebrate Zoology,Summer,1960,,San Juan Islands,"Miller, David",The food and feeding of intertidal hermit crabs,Zoology 533,Advanced Invertebrate Zoology,Summer,1960,Pagurus beringanus; Pagurus hirsutiusculus; Pagurus granosimanus,,"Potswald, Herbert E.",A study of the genus Spirorbis from the San Juan region with preliminary observations on development,Zoology 533,Advanced Invertebrate Zoology,Summer,1960,"Spirorbis; Spirorbis eximius; Laeospira",San Juan Islands,"Ridgeway, Bill T.",A survey of the animal communities associated with the eel-grass Zostera marina with attention to the burrowing forms,Zoology 533,Advanced Invertebrate Zoology,Summer,1960,"Zostera; Phyllospadix",,"Smith, Lynwood S.","Observations on Transennella tantilla, an ovoviviparous clam of the family Veneridae",Zoology 533,Advanced Invertebrate Zoology,Summer,1960,"Transennella tantilla; Aloidis",,"Waters, J.F.",Preliminary key to the Hydrozoa of the San Juan archipelago,Zoology 533,Advanced Invertebrate Zoology,Summer,1960,Campanularids; Hydrozoa,San Juan Islands,"Willson, Mary F.",A tentative key to the gammarid amphipods of the San Juan Islands,Zoology 533,Advanced Invertebrate Zoology,Summer,1960,gammarids,San Juan Islands,"Avery, John A.",Observations on certain aspects of the feeding habits of four species of carnivorous marine gastropods,Zoology 533,Advanced Invertebrate Zoology,Summer,1961,Buccinum; Neptunea; Fusitriton oregonensis,,"Bennett, Diane C.",Observations on pedicellariae of several starfish of the family Asteridae found in the San Juan area,Zoology 533,Advanced Invertebrate Zoology,Summer,1961,"Asterias forreri; Astrometis sertulifera","San Juan Islands","Campbell, Richard Dana","List of species collected, with notes on habits and ecology of fauna observed",Zoology 533,Advanced Invertebrate Zoology,Summer,1961,,Brown Island; Vancouver Island,"Cook, Emily","A study of two sponge-feeding opisthobranch mollusks, Rostanga pulchra and Archidoris montereyensis",Zoology 533,Advanced Invertebrate Zoology,Summer,1961,Rostanga pulchra; Archidoris montereyensis,,"McLaughlin, Patsy A.",The relationship of Odostomia columbiana to Trichotropis cancellata,Zoology 533,Advanced Invertebrate Zoology,Summer,1961,"Odostomia columbiana; Trichotropis cancellata",,"Mauzey, Karl P.",Some observations on the ecology of Pisaster ochraceus,Zoology 533,Advanced Invertebrate Zoology,Summer,1961,Pisaster ochraceus; Balanus cariosus; Evasterias troschelii,,"Mir, Robert D.",Sand microfauna: a preliminary survey,Zoology 533,Advanced Invertebrate Zoology,Summer,1961,,"Turn Island; Eagle Cove, San Juan Island; Reid Rock, San Juan Island","Pamatmat, Mario M.",A study of various aspects of feeding and related problems in Macoma secta and Neoamphitrite robusta,Zoology 533,Advanced Invertebrate Zoology,Summer,1961,"Macoma secta; Neoamphitrite robusta",,"Park, Tai Soo",Tentative keys to the gammarid amphipods of the San Juan area,Zoology 533,Advanced Invertebrate Zoology,Summer,1961,,San Juan Islands,"Pianka, Eric R.",A study of certain aspects of the ecology of Eubranchus olivacea,Zoology 533,Advanced Invertebrate Zoology,Summer,1961,Corambe pacifica; Eubranchus olivaceus,,"Sevilla, Josefina Z.",On the food preferences of Strongylocentrotus droebachiensis,Zoology 533,Advanced Invertebrate Zoology,Summer,1961,Strongylocentrotus droebachiensis; Nereocystis,,"Smith, Christopher C.",An ecological study of a section of the shore of Brown Island,Zoology 533,Advanced Invertebrate Zoology,Summer,1961,,"Gravelly Beach; Brown Island","Boykin, John C.",Life history and distribution of Kinorhyncha,Zoology 533,Advanced Invertebrate Zoology,Summer,1962,Pycnophyes sanjuanensis; Echinoderes; Trachydemus,,"Casey, Richard",Preliminary investigation of the Noctiluca of the Friday Harbor area,Zoology 533,Advanced Invertebrate Zoology,Summer,1962,"Noctiluca miliaris; Noctiluca scintillans",Friday Harbor,"Corliss, Sylvia","Preliminary observations on the feeding behavior of Lacuna in the Friday Harbor region, Washington",Zoology 533,Advanced Invertebrate Zoology,Summer,1962,"Lacuna; Littorina littorea",Friday Harbor,"Cundiff, Milford F.",The effects of temperature on the resistance of Mytilus edulis to hypotonic sea-water,Zoology 533,Advanced Invertebrate Zoology,Summer,1962,"Mytilus edulis; Ostrea edulis",,"Hummon, William D.",Some preliminary observations on the marine gastrotrichs of the San Juan archipelago,Zoology 533,Advanced Invertebrate Zoology,Summer,1962,Paraturbanella intermedia; Turbanella; Lepidodermella,San Juan Islands,"Hubbard, John P.",The gastropod fauna of the sub-class Prosobranchia of the San Juan archipelago,Zoology 533,Advanced Invertebrate Zoology,Summer,1962,Odostomia; Turbonilla,San Juan Islands,"Lenhoff, Howard M.",Part I: Reversible inhibition of swimming in Stomotoca atra by mesogleal extracts of some other medusae.  Part II: Observations of some Friday Harbor coelenterates.,Zoology 533,Advanced Invertebrate Zoology,Summer,1962,"Stomotoca atra; Aequorea aequorea",Friday Harbor,"Middaugh, Mical E.",Key to the genus Pagurus of the Friday Harbor area,Zoology 533,Advanced Invertebrate Zoology,Summer,1962,"Pagurus",Friday Harbor,"Palka, J.M.",Observations on the functional neuroanatomy of the cloacal region of holothurians,Zoology 533,Advanced Invertebrate Zoology,Summer,1962,Eupentacta,,"Palka, Yvonne S.",Observations on locomotion in starfish,Zoology 533,Advanced Invertebrate Zoology,Summer,1962,Leptasterias; Pycnopodia helianthoides,,"Porcaro, Carol A.",Some aspects of the Arctonoe vittata - Diodora aspera relation,Zoology 533,Advanced Invertebrate Zoology,Summer,1962,"Arctonoe vittata; Diodora aspera",,"Thut, Rudolph N.",A preliminary study of environmental factors affecting the distribution of the intertidal infauna of False Bay,Zoology 533,Advanced Invertebrate Zoology,Summer,1962,Macoma; Naididae,"False Bay, San Juan Island","Kirchenberg, Ralph",Some observations on the respiratory activity of Arenicola pacifica,Zoology 538,Comparative Invertebrate Physiology,Spring,1963,Arenicola pacifica; Nereis,,"Loe, Philip",Oxygen-dissociation curves of Octopus dofleini and Chionoecetes tanneri,Zoology 538,Comparative Invertebrate Physiology,Spring,1963,"Octopus dofleini; Chionoecetes tanneri",,"Kirchenberg, Ralph; Loe, Philip",Some observations on the properties of myoneural junctions in Chionoecetes tanneri,Zoology 538,Comparative Invertebrate Physiology,Spring,1963,"Chionoecetes tanneri",,"Loe, Philip",Some observations on the role of free amino acids in osmotic regulation in Hemigrapsus nudus and Abarenicola vagabunda,Zoology 538,Comparative Invertebrate Physiology,Spring,1963,Hemigrapsus nudus; Abarenicola vagabunda; Carcinus maenas,,"Loe, Philip",The effect of eyestalk ablation on sodium efflux in Hemigrapsus nudus,Zoology 538,Comparative Invertebrate Physiology,Spring,1963,"Hemigrapsus nudus; Pandalus danae",,