Author,Title,Class Number,Class Name,Quarter,Year,Descriptors,Location,"Rodgers, Kristen L.","Survey of nearshore soft bottom demersal fish, shrimp and crabs in North Griffin Bay, San Juan Island, Washington",Fisheries 492,Undergraduate Research Apprenticeship in Marine Fish Ecology,Fall,2002,,"Mill Street Beach, San Juan Island; Jackson Beach, San Juan Island; Griffin Bay, San Juan Island; North Bay, San Juan Island","Hargrove, John S.",Acoustic and dummy tagging of copper rockfish (Sebastes caurinus),Fisheries 492,Undergraduate Research Apprenticeship in Marine Fish Ecology,Fall,2002,Sebastes caurinus,"Lime Kiln Point, San Juan Island; Turn Island; Cliff Island; Bell Island","LaFrance, Laura","Changes in size of Puget Sound rockfish (Sebastes emphaeus) in San Juan archipelago, Washington",Fisheries 492,Undergraduate Research Apprenticeship in Marine Fish Ecology,Fall,2002,Sebastes emphaeus,"Shady Cove, San Juan Island; Turn Island; Bell Island; Pile Point, San Juan Island","Thompson, Emily",Comparison of visual capabilities of Puget Sound rockfish (Sebastes emphaeus) and copper rockfish (Sebastes caurinus),Fisheries 492,Undergraduate Research Apprenticeship in Marine Fish Ecology,Fall,2002,Sebastes emphaeus; Sebaste caurinus,San Juan Islands,"Shum, Enoch Y.; Miller-Messner, Gabrielle A.",Light-stimulated exocytosis of marine polymer gels by Cylindrotheca closterium,Zool 498,"The geophysics, geochemistry and microbiology of marine polymers",Autumn,2002,Cylindrotheca closterium,,"Harris, Jamila; Walashek, Laura S.; Verdugo, Pedro; Quesada, Ivan",Intercellular communication via ATP signaling in Phaeocystis globosa,Zool 498,"The geophysics, geochemistry and microbiology of marine polymers",Autumn,2002,Phaeocystis globosa,,"Maynard, Pamela; Vigna, Kellie",Mechanisms of storage and release of brevetoxin in the dinoflagellate Karenia brevis,Zool 498,"The geophysics, geochemistry and microbiology of marine polymers",Autumn,2002,Karenia brevis,,"Levine, Robert P.; Standen, Em","The effect of size on latency and kinematics during escape responses in Pacific Staghorn Sculpins, Leptocottus armatus",Zool 565,Fish Swimmiing,Summer,2002,Leptocottus armatus,"Jackson Beach, San Juan Island","MacNutt, Meaghan; Petersen, Maria F.",Hydrodynamic advantages in schooling shiner perch,Zool 565,Fish Swimming,Summer,2002,Cymatogaster aggregata,"Jackson Beach, San Juan Island","Paglianta, Annalisa",Effect of size on the timing of response in visually mediated escape behavior of staghorn sculpin (Leptocottus armatus),Zool 565,Fish Swimmiing,Summer,2002,Leptocottus armatus,San Juan Island,"Martinez, Gabriela M.","The effects of temperature on escape response latency in the tide pool sculpin, Oligocottus maculosus",Zool 565,Fish Swimming,Summer,2002,Oligocottus maculosus,"San Juan Island; Deadman Bay, San Juan Island; Cattle Point, San Juan Island","Zorich, Nathan",Can heart rate be used to determine feeding events in the starry flounder (Platichthys stellatus)?,Zool 565,Fish Swimming,Summer,2002,Platichthys stellatus; Pseudopleuronectes americanus; Solea solea; Dicentrarchus labrax,"East Sound, Orcas Island; Friday Harbor","Valle, A. Z. Dalla; Diaz, R. Rivas",Opercular differential pressure as a predictor of metabolic oxygen demand in starry flounder (Platichthys stellatus),Zool 565,Fish Swimming,Summer,2002,Platichthys stellatus,"East Sound, Orcas Island; San Juan Island","Cannas, Marcella; Schaefer, Justin",Gait transition and oxygen consumption in swimming striped surf perch (Embiotoca lateralis),Zool 565,Fish Swimming,Summer,2002,Embiotoca lateralis,"Jackson Beach, San Juan Island","Tomasovych, Adam",Postmortem durability and population dynamics affecting the fidelity of brachiopod size-frequency distributions,Zool 565,Fish Swimming,Summer,2002,Terebratalia transversa; Terebratulina unguicula; Modiolus modiolus,"San Juan Island; Rock Point, Lopez Island","Shum, Enoch Y.; Miller-Messner, Gabrielle A.",Light-stimulated Exocytosis of Marine Polymer Gels by Cylindrotheca closterium,Zoology 498,FHL Research Apprenticeship,Fall,2002,Cylindrotheca closterium; Exocytosis,,"Harris, Jamila; Walashek, Laura S.; Verdugo, Perdo; Quesada, Ivan",Intercellular communication via ATP signaling in Phaeocystis globosa,Zoology 498,FHL Research Apprenticeship,Fall,2002,Phaeocystis globosa; Intercellular; ATP,,"Arentzen, Gretchen M.",The Effect of 24 hour starvation on filtering rates of the scallops Chlamys hastata and Chlamys rubida,Zoology 450; Botany 445,Marine Zoology/Marine Botany,Spring,2003,Chlamys hastata; Chlamys rubida; Isochrysis,,"Blahm, Amanda","Feeding preferences of Strongylocentrotus droebachiensis between Sargassum muticum and native subtidal kelps.",Zoology 430; Botany 445,Marine Zoology / Marine Botany,Spring,2003,Strongylocentrotus droebachiensis; Sargassum muticum; Agarum fimbriatum; Nereocystis luetkeana; Laminaria bongardiana,"Reuben Tarte Park, San Juan Island; Friday Harbor Laboratories; Deadman Bay, San Juan Island","Borton, Rhonda L.",A Study of feeding preferences of Strongylocentrotus droebachiensis,Zoology 430; Botany 445,Marine Zoology / Marine Botany,Spring,2003,Strongylocentrotus droebachiensis; Mazzaella splendens; Callophyllis; Alaria marginata; Costaria costata,Friday Harbor Laboratories,"Boruch-McDonough, Teegan",Decorating habits of Pugettia gracilis: preference not abundance,Zoology 430; Botany 445,Marine Zoology / Marine Botany,Spring,2003,Pugettia gracilis; Ulva californica; Alaria marginata; Microcladia borealis,"Deadman Bay, San Juan Island; Cattle Point, San Juan Island","Branson, Korina","Algal preferences for decoration of Pugettia gracilis on San Juan Island, Washington",Zoology 430; Botany 445,Marine Zoology / Marine Botany,Spring,2003,Pugettia gracilis; Ulva californica; Alaria marginata; Microcladia borealis,"Deadman Bay, San Juan Island; Cattle Point, San Juan Island","Do, Lien",Effects of oyster Crassostrea gigas on the species diversity of rocky intertidal communities in the San Juan Islands,Zoology 430; Botany 445,Marine Zoology / Marine Botany,Spring,2003,Crassostrea gigas; Fucus,"Argyle Creek, San Juan Island; San Juan County Park, San Juan Island; Point George, Shaw Island; English Camp, San Juan Island; Kendziorek's Property; Pear Point, San Juan Island","Howieson, John",Influence of dock orientation and cover on communities of fouling organisms at two sites on San Juan Island,Zoology 430; Botany 445,Marine Zoology / Marine Botany,Spring,2003,,"Blakely Island Marina; Friday Harbor","Johnson, Lisa",Effect of UV and temperature on embryogenesis in Tritonia diomedea and Archidoris montereyensis and a comparison of development in three nudibranch species,Zoology 430; Botany 445,Marine Zoology / Marine Botany,Spring,2003,"Tritonia diomedea; Archidoris montereyensis",,"Ly, A.",Feeding preferences on the sea urchin Strongylocentrotus droebachiensis on intermediate and low preference algae,"Zoology 430; Botany 445",Marine Zoology / Marine Botany,Spring,2003,Strongylocentrotus droebachiensis; Alaria marginata; Costaria costata; Callophyllis; Mazzaella splendens,,"Masten, Meagan",The Effects of Crassostrea gigas on intertidal communities in the San Juan Islands,Zoology 430; Botany 445,Marine Zoology / Marine Botany,Spring,2003,Crassostrea gigas; Fucus,"Argyle Creek, San Juan Island; San Juan County Park, San Juan Island; Point George, Shaw Island; Pear Point, San Juan Island; Kendziorek's Property; English Camp, San Juan Island; Wescott Bay, San Juan Island","Mathis, Brenda",Male amphipod differentiation of reproductive female amphipods and 20-hydroxy ecdysone,Zoology 430; Botany 445,Marine Zoology / Marine Botany,Spring,2003,Apohyale pugettensis,"Friday Harbor Laboratories","Papiez, Chelsie",Herbivore preference for the gametophyte life history stage of Mazzaella splendens,Zoology 430; Botany 445,Marine Zoology / Marine Botany,Spring,2003,Mazzaella splendens; Littorina scutulata; Katharina tunicata; Strongylocentrotus droebachiensis,"Deadman Bay, San Juan Island","Queisser, Michael R.",Male gammarid amphipod preferences for reproductive females and 20-hydroxyecdysone,Zoology 430; Botany 445,Marine Zoology / Marine Botany,Spring,2003,Apohyale pugettensis,Friday Harbor Laboratories,"Van, Alison","Impact of Crassostrea gigas on the diversity of rocky mid-intertidal communities in the San Juan archipelago, Washington",Zoology 430; Botany 445,Marine Zoology / Marine Botany,Spring,2003,Crassostrea gigas; Fucus,"Point George, Shaw Island; Bell Point, San Juan Island; Argyle Creek, San Juan Island; San Juan County Park, San Juan Island; Pear Point, San Juan Island","Wavrin, Rochelle L.",Mate guarding:  Male amphipod detection of 20-hydroxyecdysone and reproductive female amphipods,Zoology 430; Botany 445,Marine Zoology / Marine Botany,Spring,2003,Apohyale pugettensis,Friday Harbor Laboratories,"Scannell, Christopher",The Effects of Platichthys stellatus blood serum on Ichthyophonus sp. in vitro,Fisheries 492,Emerging Diseases and Latent Infections in Aquatic Organisms,Spring,2003,Ichthyophonus; Platichthys stellatus,"San Juan Channel; East Sound, Orcas Island","Hart, S. Alexandra",The Effect of temperature and media type on the production of Ichthyophonus in vitro,Fisheries 492,Emerging Diseases and Latent Infections in Aquatic Organisms,Spring,2003,Ichthyophonus,"San Juan Channel","Jacobson, Tony",Prevalence of viral erythrocytic necrosis-like intraerythrocytic inclusion bodies in age 0 Pacific herring and age 0 chum salmon,Fisheries 492,Emerging Diseases and Latent Infections in Aquatic Organisms,Spring,2003,"Oncorhynchus keta; Clupea pallasi","Friday Harbor; Snug Harbor, San Juan Island","van der Staaten, Noelle",A New species of intraerythrocytic plasmodium-like organism found in Puget Sound rockfish (Sebastes emphaeus),Fisheries 492,Emerging Diseases and Latent Infections in Aquatic Organisms,Spring,2003,"Sebastes emphaeus","Point Caution, San Juan Island; Broken Point, Shaw Island; Pile Point, San Juan Island; Point George, Shaw Island","Josephson, Lindsey","In-vitro infection of starry flounder, Platychthyus stellatus, tissues with Ichthyophonus",Fisheries 492,Emerging Diseases and Latent Infections in Aquatic Organisms,Spring,2003,Platichthys stellatus; Ichthyophonus,,"Halos, Daniel","A Survey of Ichthyophonus in Sebastes emphaeus (Puget Sound rockfish) in the San Juan archipelago and Puget Sound, and the effects of temperature on its pathology",Fisheries 492,Emerging Diseases and Latent Infections in Aquatic Organisms,Spring,2003,Ichthyophonus; Sebastes emphaeus,"Point Caution, San Juan Island; Broken Point, Shaw Island; Pile Point, San Juan Island; Point George, Shaw Island; Puget Sound, Central","Hsu, Howard","Temperature effects and site variability on the prevalence and intensity of Microcotyle sebastis (Monogenea) infestations in the Puget Sound rockfish, Sebastes emphaeus",Fisheries 492,Emerging Diseases and Latent Infections in Aquatic Organisms,Spring,2003,Sebastes emphaeus; Microcotyle sebastis,"Point Caution, San Juan Island; Point George, Shaw Island; Pile Point, San Juan Island; Broken Point, Shaw Island; Puget Sound, Central","McDole, Tracy; Marohl, Rhonda","Molecular identification of bacterial symbionts in local Bugula species (Bryozoa, Cheilostomata)",Zoology 498,Marine Molecular Ecology,Spring,2003,"Bugula; Endobugula","Friday Harbor Laboratories; Friday Harbor; Snug Harbor, San Juan Island; Jensen's Marina, San Juan Island; Westcott Bay, San Juan Island","Durkin, Colleen","Dispersal ability of a direct developer (Littorina sitkana:  Gastropoda, Littorinacea) in the Puget Sound region and a comparison between barnacles (Balanus glandula:  Crustacea, Cirripedia)",Zoology 498,Marine Molecular Ecology,Spring,2003,Littorina sitkana; Balanus glandula,"Victoria, British Columbia; Lime Kiln Point, San Juan Island; Potlatch, Washington; Elizan Beach, Washington","McKitrick, Tanya","A Genetic and ecological description of Myxicola infundibulum  and M. aesthetica aggregations (Polychaeta, Sabellidae)",Zoology 498,Marine Molecular Ecology,Spring,2003,Myxicola infundibulum; Myxicola aesthetica,"Anacortes, Washington","Hempelmann, Jennifer",The Population Structure of Puget Sound rockfish (Sebastes emphaeus),Zoology 498,Marine Molecular Ecology,Spring,2003,Sebastes emphaeus,"Point Caution, San Juan Island; Broken Point, Shaw Island; Boeing Creek, Seattle, Washington","Caponera, Jay A.","Limited dispersal in the intertidal fish Oligocottus maculosus, and its implication for marine reserve design",Zoology 498,Marine Molecular Ecology,Spring,2003,Oligocottus maculosus,"Cattle Point, San Juan Island; Rocky Point, San Juan Island; Deadman Bay, San Juan Island; Blakely Island","Rafferty, Nicole",A Behavioral budget of a newborn killer whale (Orcinus orca) in Puget Sound,Zoology 498; Fisheries 492,Field Methods in Marine Mammalogy,Spring,2003,Orcinus orca,"Haro Strait; San Juan Channel; Swanson Channel; Active Pass; Lime Kiln Point, San Juan Island","Miller, Autumn A.",Call type stability of J-pod killer whales (Orcinus orca) in the San Juan Islands,Zoology 498; Fisheries 492,Field Methods in Marine Mammalogy,Spring,2003,Orcinus orca,"Lime Kiln Point, San Juan Island","Huntington, Brittany","Surface time intervals in southern resident killer whales (Orcinus orca) off San Juan Islands, Washington",Zoology 498; Fisheries 492,Field Methods in Marine Mammalogy,Spring,2003,Orcinus orca,"Haro Strait; Lime Kiln Point, San Juan Island","Barron, Jennifer",Killer whale (Orcinus orca) respiration rate:  influence of boat numbers,Zoology 498; Fisheries 492,Field Methods in Marine Mammalogy,Spring,2003,Orncinus orca,"Lime Kiln Point, San Juan Island; San Juan Island","Heydenreich, Erin",Movement patterns of a southern resident pod of killer whales (Orcinus orca) in greater Puget Sound,Zoology 498; Fisheries 492,Field Methods in Marine Mammalogy,Spring,2003,Orcinus orca,"Puget Sound","Hauser, Donna D.","Seasonal habitat use, including areas of pod overlap and specialization, by southern resident killer whales (Orcinus orca) in Washington State and British Columbia",Zoology 498; Fisheries 492,Field Methods in Marine Mammalogy,Spring,2003,Orcinus orca,Salish Sea; Puget Sound,"Califf, Katy",Photo-identification analysis of offshore killer whales (Orcinus orca) in Haro Strait,Zoology 498; Fisheries 492,Field Methods in Marine Mammalogy,Spring,2003,Orcinus orca,Haro Strait,"McGinnis, Leslie A.",The Effects of boat noise on the vocalization density and diversity of southern resident killer whales (Orcinus orca) in Haro Strait,Zoology 498; Fisheries 492,Field Methods in Marine Mammalogy,Spring,2003,Orcinus orca,"Haro Strait; Lime Kiln Point, San Juan Island","Jobe, Jordan",Strobilation in Aurelia aurita: hormonal induction and cellular aspects,Zoology 498,Developmental endocrinology of arthropod embryogenesis,Spring,2003,Aurelia aurita,"Jensen's Marina, San Juan Island","Zumwalt, Kari","Detection, cloning and sequencing of the Broad-Complex gene of the barnacle Balanus nubilus",Zoology 498,Developmental endocrinology of arthropod embryogenesis,Spring,2003,Balanus nubilis,Friday Harbor Laboratories; San Juan Channel,"Chea, Helen",A Comparison of the effects of juvenile hormones on the embryogenesis of Thermobia domestica and Apohyale pugettensis,Zoology 498,Developmental endocrinology of arthropod embryogenesis,Spring,2003,Thermobia domestica; Apohyale pugettensis,,"Roberts, Brock","Exogenous juvenile hormone application reveal no embryonic effect on the direct developing crustacean, Apohyale pugettensis",Zoology 498,Developmental endocrinology of arthropod embryogenesis,Spring,2003,Apohyale pugettensis,Friday Harbor Laboratories,"Chee, Christopher A.","Effects of methyl farnesoate and methoprene in barnacle cyprid larvae and in embryos of the barnacle, Balanus nubilus",Zoology 498,Developmental endocrinology of arthropod embryogenesis,Spring,2003,Balanus nubilis,San Juan Channel; Friday Harbor Laboratories,"Pacheco, Cristina",The Effects of methyl farnesoate and JH-III in embryonic and post-embryonic development of Oncopeltus fasciatus,Zoology 498,Developmental endocrinology of arthropod embryogenesis,Spring,2003,Oncopeltus fasciatus,,"Louk, Rachelle","Effects of desiccation, temperature spikes, and UV exposure on Pacific herring (Clupea pallasi) larvae",Zoology 498,Developmental endocrinology of arthropod embryogenesis,Spring,2003,Clupea pallasi,"Point Whitehorn, Washington","Andras, Jason",The Ancestral role of the mesoderm specification gene Twist in cnidarian development,Zoology 536b,Evolution and Development of the Metazoans,Summer,2003,,,"Brown, Frederico",Vasa expression and germ cells in solitary and colonial ascidians,Zoology 536b,Evolution and Development of the Metazoans,Summer,2003,Boltenia villosa; Botrylloides violaceus,"Jensen's Marina, San Juan Island; Roche Harbor, San Juan Island","Farray, Marta Diaz-Valdes",Phylogeny of tunicata: a review,Zoology 536b,Evolution and Development of the Metazoans,Summer,2003,,San Juan Island,"Donaldson, Martina",An Exploration of the mechanism for allorecognition in botryllid ascidians,Zoology 536b,Evolution and Development of the Metazoans,Summer,2003,Botrylloides violaceus,"Roche Harbor, San Juan Island","Eaves, Alexandra",Where in the world do mollusc germ cells come from?,Zoology 536b,Evolution and Development of the Metazoans,Summer,2003,Tectura persona; Chlamys hastata,"Lime Kiln Point, San Juan Island; Cattle Point, San Juan Island","Elliott, Glen",Expression pattern of EmH-3 during the development of a juvenile freshwater sponge Ephydatia muelleri (Porifera),Zoology 536b,Evolution and Development of the Metazoans,Summer,2003,Ephydatia muelleri,,"Hoch, J. Matt","Evolution, development and morphology of Brachionus plicatilis",Zoology 536b,Evolution and Development of the Metazoans,Summer,2003,Brachionus plicatilis,,"O'Donnell, Brigid C",Hox genes in cnidarians and implications for body plan evolution,Zoology 536b,Evolution and Development of the Metazoans,Summer,2003,Metridium; Urticina; Anthopleura elegantissima; Aequorea victoria; Ptilosarcus gurneyi; Stomphia; Nematostella vectensis; Gersemia rubiformis; Allopora porphyra; Stylaster porphyra; Gonionemus vertens; Clytia gregaria; Cyanea capillata; Aurelia aurita,Friday Harbor Laboratories,"Rychel, Amanda L.",Cloning and expression of a group E sox gene in Ciona savignyi,Zoology 536b,Evolution and Development of the Metazoans,Summer,2003,Ciona savignyi,,"Silva, Joann Zanol","Is there vasa in the polychaete Nereis vexillosa Grube, 1851 (Nereididae, Annelida)?  We still don't know.",Zoology 536b,Evolution and Development of the Metazoans,Summer,2003,Nereis vexillosa,"Cattle Point, San Juan Island","Snoke, Meg",The Role of even-skipped in cnidarians:  neural or anterior-posterior speciation?,Zoology 536b,Evolution and Development of the Metazoans,Summer,2003,"Anthopleura elegatissima; Phialidium gregarium","Cattle Point, San Juan Island; Friday Harbor Laboratories","White, Michael",The Molluscan riddle:  a hunt for vasa and germ cell origin,Zoology 536b,Evolution and Development of the Metazoans,Summer,2003,Chlamys hastata; Anisodoris nobilis; Mopalia muscosa; Tectura persona,,"Toran, Marcos","Effect of marine protected areas in the San Juan Channel, WA on large predatory fish",Zoology 498,Ecological Responses to Closed Fishing Zones,Fall,2003,Sebastes caurinus; Sebastes emphaeus; Sebastes maliger; Hexagrammos decagrammus; Ophiodon elongates; Scorpaenichthys marmoratus,"Shady Cove, San Juan Island; Point George, Shaw Island","Griffiths, Jennifer",Ecological effects of marine protected areas:  soft sediment infaunal response to recreational clam digging in the San Juan Channel,Zoology 498,498,"Fall",2003,Protothaca staminea,"Argyle Creek, San Juan Island; English Camp, San Juan Island; Spencer Spit, Lopez Island; Reid Harbor, Stuart Island; Shaw Island","Newsom, Amanda",Reserve effects on abundance and predator susceptibility of native and invasive littleneck clams in San Juan County,Zoology 498,Ecological Responses to Closed Fishing Zones,Fall,2003,"Venerupis philippinarum; Protothaca staminea","Shaw Island Reserve; English Camp, San Juan Island; Argyle Creek, San Juan Island; Stuart Island; Mud Bay, Lopez Island; Spencer Spit, Lopez Island; East Sound, Orcas Island","Turner, Kevin R.","Indirect effects of marine reserves on several species of snails, small crabs and scallops in San Juan Channel, Washington",Zoology 498,Ecological Responses to Closed Fishing Zones,fall,2003,"Amphissa; Trichotropis; Nucella; Calliostoma; Chlamys; Scyra acutifrons; Oregonia gracilis","Point George, Shaw Island; Shady Cove, San Juan Island; Eagle Point, San Juan Island; Neck Point, Shaw Island","Selgrath, Jennifer C.","Indirect effects of marine reserve status on abundance of small, cryptic reef fish and shrimps, San Juan Channel, WA",Zoology 498,Ecological Responses to Closed Fishing Zones,Fall,2003,Pandalus danae; Jordania zonope; Artedius harringtoni,"Shady Cove, San Juan Island; Point George, Shaw Island","Lunstrom, Abby M.","Responses of sea urchins (Strongylocentrotus franciscanus) and shrimp (Pandalus danae and Heptacarpus kincaidi) to increasing predatory fish densities in marine protected areas in the San Juan Channel, Washington",Zoology 498,Ecological Responses to Closed Fishing Zones,Fall,2003,Pandalus danae; Heptacarpus kincaidi; Strongylocentrotus franciscanus,"Shady Cove, San Juan Island; Point George, Shaw Island; Yellow Island","Brand, Emily J.",Modeling the ecosystem-level effects of marine protected area policies in the San Juan Channel,Zoology 498,Ecological Responses to Closed Fishing Zones,Fall,2003,,San Juan Channel,"Harm, Jessica","Effects of marine reserves on densities and body size of sea stars, Henricia, Pycnopodia, and Evasterias, and the sea cucumber, Parastichopus californicus, in San Juan, Washington",Zoology 498,Ecological Responses to Closed Fishing Zones,Fall,2003,Henricia leviuscula; Pycnopodia helianthoides; Parastichopus californicus; Evasterias troschelii,"Shady Cove, San Juan Island; Point George, Shaw Island; Yellow Island","Lyons, Courtney","Relative rates of predation on the scallops Chlamys rubida and C. hastata and the urchins Strongylocentrotus droebachiensis and S. pallidus inside and outside of marine reserves in the San Juan Island Archipelago, WA, USA",Zoology 498,Ecological Responses to Closed Fishing Zones,Fall,2003,Chlamys rubida; Chlamys hastata; Strongylocentrotus droebachiensis; Strongylocentrotus pallidus,"Point George, Shaw Island; Neck Point, Shaw Island; Jones Island; Yellow Island; Shady Cove, San Juan Island; Dock Point, San Juan Island","Smith, Shannon S.",Relative predation pressure of different sized predators inside and outside marine reserves:  a caged tethering experiment,Zoology 498,Ecological Responses to Closed Fishing Zones,Fall,2003,,"Shady Cove, San Juan Island; Point George, Shaw Island; Yellow Island; Dock Point, San Juan Island; Neck Point, Shaw Island; Jones Island","Glaub, Amy","Physical and biological factors limiting the invasion of a non-native clam to marine reserve and non-reserve areas in the San Juan Archipelago, Washington",Zoology 498,Ecological Responses to Closed Fishing Zones,Fall,2003,Nuttallia obscurata,"Echo Bay, Sucia Island; Argyle Bay, San Juan Island; East Sound, Orcas Island; Spencer Spit, Lopez Island; English Camp, San Juan Island; Guthrie Cove, Orcas Island; Argyle Creek, San Juan Island; Shoal Bay, Lopez Island; Parks Bay, Shaw Island; Jackson Beach, San Juan Island; Turn Island; Odlin Park, Lopez Island; Squaw Bay, Shaw Island","Carlson, Leah M.",Effects of marine protected areas on populations of generalist predators in the San Juan Islands,Zoology 498,Ecological Responses to Closed Fishing Zones,Fall,2003,,"Shady Cove, San Juan Island; Dock Point, San Juan Island; Turn Island; Point George, Shaw Island; Neck Point, Shaw Island; Yellow Island","Maynard, Pamela; Vigna, Kellie",Mechanisms of storage and release of Brevetoxin in the Dinoflagellate Karenia brevis,Zoology 498,Marine Biopolymers Research Apprenticeship,Fall,2003,Karenia brevis; Algal; toxin storage,,"Dahmen, Jeremy","Changes in intertidal communities of macroalgae and sessile invertebrates over a fifteen year period (1989-2004) at Cattle Point, San Juan Island Washington, USA",Biol 539,Marine Phycology,Summer,2004,Hedophyllum; Anthopleura elegantissima; Porphyra; Endocladia; Polysiphonia; Fucus,"Cattle Point, San Juan Island","Dwyer, Timothy R.","Population genetic subdivision in the tidepool sculpin (Oligocottus maculosus) in the San Juan Islands, Washington",ZOO 499G,Marine Molecular Ecology,Spring,2004,Oligocottus maculosis; sculpin,San Juan Islands,"Lingwood, Portia M; Goodsell, Todd; Chamberlin, Josh",Molecular identification of rockfish larvae (Sebastes caurinus and S. maliger) in the San Juan Archipelago,Zoology 499G,Marine Molecular Ecology,Spring,2004,Sebastes caurinus; Sebastes maliger,San Juan Islands,"Peterson, Karen L.",Cyanobacterial strain classification in the Northwest Straits,Zoology 499G,Marine Molecular Ecology,Spring,2004,cyanobacteria; Synechococcus,,"Plough, Louis","A genetic analysis of surf smelt (Hypomesus pretiosus) population structure in the Northwest Straits region, WA",Zoology 499G,Marine Molecular Ecology,Spring,2004,Hypomesus pretiosus; pacific surf smelt,,"Porter, Kimberly","Genetic structure in the behaviorally variable sea slug, Tritonia diomedea, in the coastal waters of Washington",Zoology 499G,Marine Molecular Ecology,Spring,2004,Tritonia diomedea; sea slug,,"Porter, Stephanie",Regaining larval feeding from a non-feeding ancestral state? A molecular analysis of serpulid polychaete phylogeny,Zoology 499G,Marine Molecular Ecology,Spring,2004,larvae; polychaete; Serpulidae,,